{
  "alert_id": "simulated-azure-activity-repeated-failures-001",
  "severity": "medium",
  "source": "azure_activity",
  "resource_id": null,
  "timestamp": "2026-10-20T19:30:00Z",
  "recommended_action": "Review the failed operations and confirm whether the caller's activity was expected. No automated action was taken.",
  "sentinel": {
    "system_alert_id": null,
    "incident_arm_id": null,
    "incident_number": null,
    "incident_url": null
  },
  "evidence": {
    "client_ip": "192.0.2.99",
    "event_count": 5,
    "simulation": true
  }
}
